Page URL,Page Title,H1,Word Count,Priority Keywords,Content Sections Required,Schema Type,Internal Links To,Priority Level
/,Pacific Unity MEA | Industrial Equipment Supplier Dubai | Feed Processing & Water Treatment,Industrial Equipment Supplier in Dubai & UAE,1200-1500,Pacific Unity MEA, industrial equipment supplier Dubai, feed production equipment UAE,Hero, Services Overview, Featured Products, Why Choose Us, Geographic Coverage, Trust Signals,Organization + LocalBusiness,Top 10 priority pages,CRITICAL
/equipment/feed-processing/,Feed Processing Equipment UAE | Complete Feed Mill Solutions | Pacific Unity,Feed Processing Equipment for UAE & Middle East,1500-2000,feed processing equipment UAE, feed mill equipment Dubai, animal feed production equipment,Overview, Product Categories, Applications, Benefits, Process Flow, Capacity Ranges,Service + Product,All product sub-pages,CRITICAL
/equipment/feed-processing/pellet-mills/,Pellet Mill Dubai | Gear Drive & Belt Driven Pellet Mills UAE | Pacific Unity,Pellet Mills for Feed Production in Dubai & UAE,2500-3000,pellet mill Dubai, pellet mill UAE, gear drive pellet mill, animal feed pellet mill, pellet mill price,Product Overview, Product Types, Applications, Technical Specs, Comparison Table, Pricing, Installation, Case Studies, FAQ,Product (with price range),Complete feed mills, hammer mills, buying guides,HIGH
/equipment/feed-processing/pellet-mills/gear-drive-pellet-mill/,Gear Drive Pellet Mill Dubai | High Performance Pellet Mills UAE,Gear Drive Pellet Mill for Feed Production,2000-2500,gear drive pellet mill Dubai, gear drive pellet mill UAE,Product Details, Specifications, Benefits, Applications, Pricing Range, Installation,Product,Main pellet mills page, complete feed mills,MEDIUM
/equipment/feed-processing/pellet-mills/belt-driven-pellet-mill/,Belt Driven Pellet Mill Dubai | Affordable Pellet Mills UAE,Belt Driven Pellet Mill Solutions,2000-2500,belt driven pellet mill Dubai, belt driven pellet mill UAE,Product Details, Specifications, Benefits, Applications, Pricing Range,Product,Main pellet mills page, comparison guide,MEDIUM
/equipment/feed-processing/pellet-mills/pellet-mill-price/,Pellet Mill Price UAE | Pellet Mill Cost Dubai | Pricing Guide,Pellet Mill Prices and Costs in UAE & Dubai,1500-2000,pellet mill price UAE, pellet mill cost Dubai, pellet mill for sale UAE,Pricing Overview, Price Ranges by Capacity, Factors Affecting Price, Financing Options, Request Quote CTA,Service,Main pellet mills page, contact,QUICK WIN
/equipment/feed-processing/hammer-mills/,Hammer Mill UAE | SFSP & Water Drop Hammer Mills Dubai | Prices,Hammer Mills for Feed Processing in UAE & Dubai,2000-2500,hammer mill UAE, hammer mill Dubai, hammer mill price UAE, SFSP hammer mill,Product Overview, Product Types, Technical Specs, Applications, Pricing Guide, Comparison, Maintenance, FAQ,Product (with price range),Pellet mills, complete feed mills, buying guides,CRITICAL
/equipment/feed-processing/hammer-mills/sfsp-hammer-mill/,SFSP Hammer Mill Dubai | Advanced Feed Grinding Technology,SFSP Hammer Mill - Advanced Feed Processing,1800-2200,SFSP hammer mill Dubai, SFSP hammer mill UAE,Product Details, Unique Features, Specifications, Applications, Benefits,Product,Main hammer mills page, comparison guide,QUICK WIN
/equipment/feed-processing/hammer-mills/water-drop-hammer-mill/,Water Drop Hammer Mill Dubai | Efficient Feed Grinding Solutions,Water Drop Hammer Mill for Feed Processing,1800-2200,water drop hammer mill Dubai, water drop hammer mill,Product Details, Technology, Specifications, Applications,Product,Main hammer mills page,QUICK WIN
/equipment/feed-processing/hammer-mills/hammer-mill-price/,Hammer Mill Price UAE | Hammer Mill Cost Dubai | Pricing Information,Hammer Mill Prices and Costs in UAE,1500-2000,hammer mill price UAE, hammer mill cost Dubai,Pricing Overview, Price Ranges, Factors, Request Quote,Service,Main hammer mills page, contact,CRITICAL
/equipment/feed-processing/mixers/,Twin Shaft Mixer Dubai | Paddle & Ribbon Mixers UAE | Pacific Unity,Feed Mixers for Dubai & UAE Feed Production,2000-2500,twin shaft mixer Dubai, paddle mixer, feed mixer,Product Overview, Types, Specifications, Applications, Comparison,Product,Complete feed mills, pellet mills,MEDIUM
/equipment/feed-processing/extruders/,Twin Screw Extruder Dubai | Fish Feed Extruders UAE | MFPH Series,Twin Screw Extruders for Aquatic Feed Production,2000-2500,twin screw extruder, fish feed extruder, aquatic feed extruder, MFPH extruder,Product Overview, MFPH Series Details, Applications, Specifications,Product,Aquatic feed plants, complete solutions,QUICK WIN
/equipment/feed-processing/extruders/mfph-extruder/,MFPH Extruder UAE | Aquatic Feed Extrusion Technology,MFPH Series Twin Screw Extruder,1800-2200,MFPH extruder, MFPH extruder UAE,Product Details, Technology, Specifications, Applications,Product,Extruders page, aquatic feed plants,QUICK WIN
/equipment/feed-processing/dryers-coolers/,Feed Dryer & Cooler Dubai | Steam Dryers & Counterflow Coolers UAE,Feed Dryers and Coolers for Feed Production,2000-2500,feed dryer Dubai, feed cooler, MFHG steam dryer,Product Overview, Types, Specifications, Applications,Product,Complete feed mills,MEDIUM
/solutions/complete-feed-mills/,Complete Feed Mill Dubai | Turnkey Feed Production Line UAE | Pacific Unity,Complete Feed Mill Solutions for Dubai & UAE,3000-4000,complete feed mill Dubai, feed production line, turnkey feed plant, animal feed production line,Solution Overview, Capacity Options, Process Flow, Equipment Included, Project Timeline, ROI Calculator, Case Studies, Pricing Guide, FAQ,Service + Product,All component equipment pages,CRITICAL
/solutions/complete-feed-mills/1-ton-per-hour-feed-mill/,1 Ton Per Hour Feed Mill UAE | Small Scale Feed Production Line,1 Ton Per Hour Feed Mill for UAE,2000-2500,1 ton per hour feed mill UAE, small scale feed mill,Solution Details, Equipment Package, Specifications, Applications, Pricing,Service,Complete feed mills page,QUICK WIN
/solutions/complete-feed-mills/turnkey-feed-plant/,Turnkey Feed Plant Dubai | Complete Feed Mill Installation UAE,Turnkey Feed Plant Solutions,2500-3000,turnkey feed plant Dubai, turnkey feed plant UAE, complete feed mill installation,Solution Overview, What's Included, Installation Process, Timeline, Pricing,Service,Complete feed mills page, buying guides,MEDIUM
/solutions/aquatic-feed-plants/,Fish Feed Plant Dubai | Aquatic Feed Production Line UAE | Pacific Unity,Aquatic Feed Production Solutions for Dubai & UAE,2500-3000,fish feed plant Dubai, fish feed plant UAE, shrimp feed line,Solution Overview, Applications, Process, Equipment, Case Studies,Service + Product,Extruders, complete solutions,CRITICAL
/solutions/aquatic-feed-plants/fish-feed-plant/,Fish Feed Plant Dubai | Complete Fish Feed Production Line UAE,Complete Fish Feed Plant Solutions,2000-2500,fish feed plant Dubai, fish feed plant UAE,Solution Details, Equipment, Process, Applications,Service,Aquatic feed plants page, extruders,CRITICAL
/solutions/aquatic-feed-plants/shrimp-feed-line/,Shrimp Feed Line Dubai | Shrimp Feed Production Equipment UAE,Shrimp Feed Production Line Solutions,2000-2500,shrimp feed line Dubai, shrimp feed production,Solution Details, Specialized Equipment, Process, Applications,Service,Aquatic feed plants page,QUICK WIN
/equipment/water-beverage/water-treatment/,Water Treatment Plant Dubai | RO Plant UAE | Industrial Water Treatment,Water Treatment Plants & RO Systems for Dubai & UAE,2500-3000,water treatment plant Dubai, RO plant UAE, water treatment plant price,Solution Overview, Product Types, Applications, Capacity Options, Technical Specs, Pricing Guide, Installation, Case Studies,Product + Service,Complete solutions, beverage lines,CRITICAL
/equipment/water-beverage/water-treatment/ro-plant/,RO Plant Dubai | Reverse Osmosis Water Treatment UAE,RO Plant Solutions for Dubai & UAE,2000-2500,RO plant Dubai, RO plant UAE, reverse osmosis plant,Product Details, Technology, Specifications, Applications, Pricing,Product,Water treatment page,CRITICAL
/equipment/water-beverage/water-treatment/ro-plant-price/,RO Plant Price UAE | Water Treatment Plant Cost Dubai,RO Plant Prices and Water Treatment Costs,1500-2000,RO plant price, water treatment plant price UAE, water treatment plant cost,Pricing Overview, Price Ranges, Factors, Request Quote,Service,RO plant page, contact,CRITICAL
/equipment/water-beverage/steam-boilers/,Steam Boiler Dubai | Industrial Steam Boilers UAE | Pacific Unity,Steam Boilers for Industrial Applications in Dubai & UAE,2000-2500,steam boiler Dubai, steam boiler UAE, industrial steam boiler,Product Overview, Types, Specifications, Applications,Product,Water treatment, feed processing,MEDIUM
/equipment/filling-packaging/,Filling & Packaging Machines Dubai | Labeling & PET Blowing UAE,Filling and Packaging Equipment for Dubai & UAE,2000-2500,labeling machine Dubai, filling machine, PET blowing machine,Category Overview, Product Types, Applications, Comparison Tables,Product,Water bottling lines, beverage lines,CRITICAL
/equipment/filling-packaging/filling-machines/rotary-filling-machine/,Rotary Filling Machine Dubai | High Speed Bottle Fillers UAE,Rotary Filling Machines for Dubai & UAE,2000-2500,rotary filling machine Dubai, rotary filling machine UAE, rotary filling machine supplier,Product Details, Specifications, Applications, Speed, Accuracy,Product,Labeling machines, complete lines,CRITICAL
/equipment/filling-packaging/filling-machines/piston-filling-machine/,Piston Filling Machine Dubai | Viscous Product Fillers UAE,Piston Filling Machines for Thick Products,2000-2500,piston filling machine Dubai, piston filling machine,Product Details, Applications, Specifications, Comparison with Rotary,Product,Rotary filling page, comparison guide,MEDIUM
/equipment/filling-packaging/labeling-machines/,Labeling Machine Dubai | BOPP Shrink & Sticker Labelers UAE,Labeling Machines for Dubai & UAE Industries,2000-2500,labeling machine Dubai, labeling machine UAE, BOPP labeling,Product Overview, Types (BOPP, Shrink, Sticker), Specifications, Applications, Comparison,Product,Complete packaging lines,CRITICAL
/equipment/filling-packaging/labeling-machines/bopp-labeling/,BOPP Labeling Machine Dubai | BOPP Label Applicators UAE,BOPP Labeling Machine Solutions,1800-2200,BOPP labeling machine Dubai, BOPP labeling machine UAE,Product Details, Technology, Specifications, Applications, Benefits,Product,Labeling machines page,QUICK WIN
/equipment/filling-packaging/pet-blowing-machine/,PET Blowing Machine Dubai | PET Bottle Manufacturing Equipment UAE,PET Blowing Machines for Bottle Production,2000-2500,PET blowing machine Dubai, PET bottle blowing machine,Product Details, Specifications, Applications, Capacity,Product,Complete beverage lines,MEDIUM
/equipment/tanks-vessels/stainless-steel-tanks/,Stainless Steel Tanks Dubai | Mixing & Storage Tanks UAE | Pacific Unity,Stainless Steel Tanks for Dubai & UAE Industries,2000-2500,stainless steel tanks Dubai, stainless steel tanks UAE, mixing tank, storage tank,Product Overview, Types, Applications, Technical Specs, Customization, Fabrication Process,Product,Water treatment, food processing,CRITICAL
/equipment/tanks-vessels/stainless-steel-tanks/mixing-tanks/,Mixing Tank Dubai | Stainless Steel Mixing Vessels UAE,Stainless Steel Mixing Tanks for Dubai & UAE,1800-2200,mixing tank Dubai, mixing tank UAE,Product Details, Specifications, Applications, Agitator Options,Product,Main tanks page,CRITICAL
/equipment/tanks-vessels/stainless-steel-tanks/storage-tanks/,Storage Tank Dubai | Industrial Storage Vessels UAE,Industrial Storage Tanks for Dubai & UAE,1800-2200,storage tank Dubai, storage tank UAE,Product Details, Specifications, Applications, Capacity Options,Product,Main tanks page,CRITICAL
/equipment/tanks-vessels/stainless-steel-tanks/blending-vessels/,Blending Vessel Dubai | Stainless Steel Blending Tanks UAE,Blending Vessels for Industrial Applications,1800-2200,blending vessel Dubai, blending vessel UAE,Product Details, Specifications, Applications,Product,Main tanks page,MEDIUM
/services/installation/,Feed Mill Installation Dubai | Equipment Installation Services UAE,Industrial Equipment Installation Services,1000-1500,feed mill installation Dubai, equipment installation, RO plant installation,Service Overview, Installation Process, Timeline, What's Included, Case Studies,Service,All product pages,CRITICAL
/services/maintenance/,Equipment Maintenance Dubai | Preventive Maintenance Services UAE,Industrial Equipment Maintenance Services,1000-1500,equipment maintenance Dubai, feed mill maintenance, RO plant maintenance,Service Overview, Maintenance Packages, Schedules, Emergency Service,Service,All product pages,MEDIUM
/services/training/,Equipment Training Dubai | Feed Mill Training Programs UAE,Industrial Equipment Training Programs,1000-1500,feed mill training Dubai, equipment training,Service Overview, Training Programs, On-Site Training, Course Content,Service,All product pages,MEDIUM
/services/spare-parts/,Spare Parts Supplier Dubai | Equipment Parts UAE | Pacific Unity,Industrial Equipment Spare Parts Supplier,1000-1500,spare parts supplier Dubai, feed mill spare parts, extruder spare parts,Service Overview, Parts Catalog, Availability, Ordering Process,Service,All product pages,MEDIUM
/services/commissioning/,Equipment Commissioning Dubai | Feed Mill Commissioning UAE,Industrial Equipment Commissioning Services,1000-1500,feed mill commissioning, equipment commissioning,Service Overview, Commissioning Process, Testing, Handover,Service,All product pages,MEDIUM
/resources/buying-guides/,Buying Guides | How to Choose Industrial Equipment | Pacific Unity,Industrial Equipment Buying Guides,1500-2000,how to choose pellet mill, how to choose water treatment plant, buying guides,Guide List, Links to All Guides,Article,All product pages,MEDIUM
/resources/buying-guides/how-to-choose-pellet-mill/,How to Choose a Pellet Mill | Complete Buying Guide 2024,How to Choose the Right Pellet Mill,2000-2500,how to choose pellet mill, pellet mill buying guide,Factors to Consider, Capacity Selection, Type Selection, Price Considerations, Checklist,HowTo + Article,Pellet mills page, comparison guide,HIGH
/resources/buying-guides/how-to-choose-water-treatment-plant/,How to Choose a Water Treatment Plant | RO Plant Selection Guide,How to Choose a Water Treatment Plant,2000-2500,how to choose water treatment plant, RO plant selection,Factors, Capacity Calculation, Quality Requirements, Budget,HowTo + Article,Water treatment page,HIGH
/resources/buying-guides/feed-mill-capacity-selection/,Feed Mill Capacity Selection Guide | Calculate Your Needs,Feed Mill Capacity Selection Guide,1500-2000,feed mill capacity selection, feed mill capacity calculator,Capacity Calculation, Factors, Calculator Tool, Examples,HowTo + Article,Complete feed mills page, tools,MEDIUM
/resources/comparison-guides/,Equipment Comparison Guides | Industrial Equipment Comparisons,Industrial Equipment Comparison Guides,1500-2000,gear drive vs belt driven, rotary vs piston, comparison guides,Guide List, Links to All Comparisons,Article,All product pages,MEDIUM
/resources/comparison-guides/gear-drive-vs-belt-driven-pellet-mill/,Gear Drive vs Belt Driven Pellet Mill | Complete Comparison,Gear Drive vs Belt Driven Pellet Mill Comparison,2000-2500,gear drive vs belt driven pellet mill, pellet mill comparison,Comparison Table, Pros & Cons, When to Use Each, Recommendations,Article,Pellet mills pages, buying guide,HIGH
/resources/comparison-guides/rotary-vs-piston-filling-machine/,Rotary vs Piston Filling Machine | Which One to Choose?,Rotary vs Piston Filling Machine Comparison,1800-2200,rotary vs piston filling machine, filling machine comparison,Comparison Table, Applications, Pros & Cons, Recommendations,Article,Filling machines pages, buying guide,MEDIUM
/resources/comparison-guides/bopp-vs-shrink-labeling/,BOPP vs Shrink Labeling | Labeling Machine Comparison,BOPP vs Shrink Labeling Comparison,1500-2000,BOPP vs shrink labeling, labeling machine comparison,Comparison Table, Cost Analysis, Quality Comparison, Recommendations,Article,Labeling machines page,MEDIUM
/locations/dubai/,Industrial Equipment Supplier Dubai | Pacific Unity MEA,Industrial Equipment Supplier in Dubai,800-1200,industrial equipment supplier Dubai, feed mill equipment Dubai,Local Presence, Service Area, Contact Information, Projects in Dubai,LocalBusiness + Place,All product pages, service pages,CRITICAL
/locations/uae/,Industrial Equipment Supplier UAE | Pacific Unity MEA,Industrial Equipment Supplier in UAE,800-1200,industrial equipment supplier UAE, equipment supplier UAE,Country Coverage, Major Cities, Service Areas, Contact,LocalBusiness + Place,All product pages,CRITICAL
/locations/saudi-arabia/,Industrial Equipment Supplier Saudi Arabia | Pacific Unity MEA,Industrial Equipment Supplier in Saudi Arabia,800-1200,industrial equipment supplier Saudi Arabia, feed mill Saudi Arabia,Market Expansion, Service Areas, Projects, Contact,LocalBusiness + Place,All product pages, location pages,MEDIUM
/locations/riyadh/,Industrial Equipment Supplier Riyadh | Feed Mill Equipment Riyadh,Industrial Equipment Supplier in Riyadh,800-1200,equipment supplier Riyadh, feed mill Riyadh,Local Service, Projects, Contact,LocalBusiness + Place,Saudi Arabia page, product pages,MEDIUM
/resources/case-studies/,Case Studies | Industrial Equipment Projects | Pacific Unity,Industrial Equipment Project Case Studies,2000-2500,feed mill case study, water treatment case study,Project List, Links to All Case Studies,Article,All product pages, solution pages,MEDIUM
/resources/case-studies/5-ton-feed-mill-dubai/,5 Ton Per Hour Feed Mill Dubai | Complete Project Case Study,5 Ton Per Hour Feed Mill Project in Dubai,1500-2000,feed mill case study Dubai, complete feed mill project,Project Overview, Challenge, Solution, Results, Testimonials,CaseStudy,Complete feed mills page, pellet mills, pellet mills,MEDIUM
/resources/faq/,FAQ | Industrial Equipment Frequently Asked Questions,Industrial Equipment FAQ,3000+,feed mill FAQ, pellet mill questions, water treatment FAQ,FAQ by Category, 50+ Questions with Answers,FAQPage,All product pages, service pages,LOW
/about/,About Pacific Unity MEA | Industrial Equipment Supplier Dubai & UAE,About Pacific Unity MEA,1000-1500,Pacific Unity MEA, about us,Company History, Team, Values, Certifications, Mission,Organization,Homepage, contact,CRITICAL
/contact/,Contact Pacific Unity MEA | Industrial Equipment Supplier Dubai,Contact Pacific Unity MEA,800-1000,contact Pacific Unity, request quote,Contact Form, Office Locations, Phone, Email, Map,ContactPage,All pages,CRITICAL
/request-quote/,Request Quote | Industrial Equipment Quote Request | Pacific Unity,Request a Quote for Industrial Equipment,800-1000,request quote, get quote,Quote Request Form, Product Selection, Requirements, Contact Info,ContactPage,All product pages,CRITICAL

