Product Category,Product,Keyword,Search Volume (Est.),Competition,Intent,Geographic Focus,Priority Score,Ranking Difficulty (Months)
,,water drop hammer mill Dubai,35,Medium,Commercial,Dubai,15,3-6 months
,,aquatic feed extruder Dubai,14,Low,Commercial,Dubai,8,2-4 months
Complete Solutions,Animal Feed Production Line,complete feed mill Dubai,70,Medium,Commercial,Dubai,31,3-6 months
Complete Solutions,Animal Feed Production Line,complete feed mill UAE,70,Medium,Commercial,UAE,31,3-6 months
Complete Solutions,Animal Feed Production Line,turnkey feed plant Dubai,21,Medium,Commercial,Dubai,9,3-6 months
Complete Solutions,Animal Feed Production Line,turnkey feed plant UAE,52,Medium,Commercial,UAE,23,3-6 months
,,feed production line Dubai,350,Medium,Commercial,Dubai,157,4-6 months
,,feed production line UAE,350,Medium,Commercial,UAE,157,4-6 months
Complete Solutions,Animal Feed Production Line,animal feed production line Dubai,350,Medium,Commercial,Dubai,157,4-6 months
Complete Solutions,Animal Feed Production Line,animal feed production line UAE,350,Medium,Commercial,UAE,157,4-6 months
Water & Beverage Processing,Water Treatment Plant,water treatment plant Dubai,350,Medium,Commercial,Dubai,157,4-6 months
Water & Beverage Processing,Water Treatment Plant,RO plant Dubai,70,Medium,Commercial,Dubai,31,3-6 months
Water & Beverage Processing,Water Treatment Plant,RO plant UAE,70,Medium,Commercial,UAE,31,3-6 months
Water & Beverage Processing,Water Treatment Plant,water treatment plant supplier UAE,140,Medium,Commercial,UAE,63,4-6 months
Water & Beverage Processing,Water Treatment Plant,RO plant supplier Dubai,35,Medium,Commercial,Dubai,15,3-6 months
Water & Beverage Processing,Water Treatment Plant,water treatment plant price UAE,140,Medium,Transactional,UAE,70,4-6 months
Filling & Packaging,Labeling Machine,labeling machine Dubai,350,Medium,Commercial,Dubai,157,4-6 months
Filling & Packaging,Labeling Machine,labeling machine UAE,350,Medium,Commercial,UAE,157,4-6 months
Filling & Packaging,Labeling Machine,BOPP labeling machine Dubai,14,Medium,Commercial,Dubai,6,3-6 months
Filling & Packaging,Labeling Machine,BOPP labeling machine UAE,21,Medium,Commercial,UAE,9,3-6 months
Filling & Packaging,Rotary Filling Machine,rotary filling machine Dubai,35,Medium,Commercial,Dubai,15,3-6 months
Filling & Packaging,Rotary Filling Machine,rotary filling machine UAE,350,Medium,Commercial,UAE,157,4-6 months
Filling & Packaging,Piston Filling Machine,piston filling machine Dubai,35,Medium,Commercial,Dubai,15,3-6 months
Filling & Packaging,PET Blowing Machine,PET blowing machine Dubai,140,High,Commercial,Dubai,42,9-12 months
Tanks & Vessels,Stainless Steel Tanks,stainless steel tanks Dubai,350,Medium,Commercial,Dubai,157,4-6 months
Tanks & Vessels,Stainless Steel Tanks,stainless steel tanks UAE,70,Medium,Commercial,UAE,31,3-6 months
Tanks & Vessels,Stainless Steel Tanks,mixing tank Dubai,70,Medium,Commercial,Dubai,31,3-6 months
Tanks & Vessels,Stainless Steel Tanks,mixing tank UAE,52,Medium,Commercial,UAE,23,3-6 months
Tanks & Vessels,Stainless Steel Tanks,blending vessel Dubai,70,Medium,Commercial,Dubai,31,3-6 months
Tanks & Vessels,Stainless Steel Tanks,storage tank Dubai,350,Medium,Commercial,Dubai,157,4-6 months
,,poultry feed pellet mill Dubai,21,Medium,Commercial,Dubai,9,3-6 months
,,fish feed pellet mill Dubai,35,Low,Commercial,Dubai,21,2-4 months
Complete Solutions,Aquatic Feed Production Line,fish feed plant Dubai,350,Medium,Commercial,Dubai,157,4-6 months
Complete Solutions,Aquatic Feed Production Line,fish feed plant UAE,140,Medium,Commercial,UAE,63,4-6 months
Complete Solutions,Aquatic Feed Production Line,shrimp feed line Dubai,70,Medium,Commercial,Dubai,31,3-6 months
Water & Beverage Processing,Steam Boiler,steam boiler Dubai,35,Medium,Commercial,Dubai,15,3-6 months
Water & Beverage Processing,Steam Boiler,steam boiler UAE,35,Medium,Commercial,UAE,15,3-6 months
Water & Beverage Processing,Homogenizer/Pasteurizer,homogenizer Dubai,21,Medium,Commercial,Dubai,9,3-6 months
Water & Beverage Processing,Homogenizer/Pasteurizer,pasteurizer Dubai,14,Medium,Commercial,Dubai,6,3-6 months
Water & Beverage Processing,Water Treatment Plant,water treatment plant Saudi Arabia,250,Medium,Commercial,Saudi Arabia,112,4-6 months
Water & Beverage Processing,Water Treatment Plant,RO plant Riyadh,37,Medium,Commercial,Saudi Arabia,16,3-6 months
Tanks & Vessels,Stainless Steel Tanks,stainless steel tanks Saudi Arabia,50,Medium,Commercial,Saudi Arabia,22,3-6 months
Tanks & Vessels,Stainless Steel Tanks,stainless steel tanks Riyadh,25,Medium,Commercial,Saudi Arabia,11,3-6 months
Complete Solutions,Animal Feed Production Line,feed production line Saudi Arabia,250,Medium,Commercial,Saudi Arabia,112,4-6 months
Complete Solutions,Animal Feed Production Line,feed production line Riyadh,50,Medium,Commercial,Saudi Arabia,22,3-6 months
,,automatic pellet mill Dubai,14,Low,Commercial,Dubai,8,2-4 months
,,small scale pellet mill Dubai,35,Low,Commercial,Dubai,21,2-4 months
,,industrial pellet mill Dubai,21,Medium,Commercial,Dubai,9,3-6 months
,,extruder supplier Dubai,35,Medium,Commercial,Dubai,15,3-6 months
Complete Solutions,Animal Feed Production Line,1 ton per hour feed mill UAE,52,Low,Commercial,UAE,31,2-4 months
Complete Solutions,Animal Feed Production Line,5 ton per hour feed mill UAE,35,Low,Commercial,UAE,21,2-4 months
Complete Solutions,Animal Feed Production Line,poultry feed line Dubai,35,Medium,Commercial,Dubai,15,3-6 months
,,industrial RO plant Dubai,70,Medium,Commercial,Dubai,31,3-6 months
Water & Beverage Processing,Water Treatment Plant,water purification system Dubai,70,Medium,Commercial,Dubai,31,3-6 months
Filling & Packaging,Labeling Machine,labeling machine supplier UAE,140,High,Commercial,UAE,42,9-12 months
Filling & Packaging,Rotary Filling Machine,rotary filling machine supplier UAE,350,Medium,Commercial,UAE,157,4-6 months
Filling & Packaging,Piston Filling Machine,piston filling machine supplier UAE,35,Medium,Commercial,UAE,15,3-6 months
,,stainless steel tank supplier Dubai,350,Medium,Commercial,Dubai,157,4-6 months
,,stainless steel tank manufacturer UAE,70,High,Commercial,UAE,21,6-9 months
Tanks & Vessels,Fermentation Tank,fermentation tank Dubai,21,Medium,Commercial,Dubai,9,3-6 months
,,feed cooler supplier Dubai,70,Medium,Commercial,Dubai,31,3-6 months
,,complete feed mill installation Dubai,140,Medium,Commercial,Dubai,63,4-6 months
,,feed mill setup Dubai,35,Medium,Commercial,Dubai,15,3-6 months
,,complete RO plant installation UAE,70,Medium,Commercial,UAE,31,3-6 months
,,automatic labeling machine Dubai,140,Medium,Commercial,Dubai,63,4-6 months
,,feed production line supplier Dubai,350,Medium,Commercial,Dubai,157,4-6 months
